{
  "$schema": "https://json-schema.org/draft/2020-12/schema",
  "$id": "https://moblend.dev/schemas/catalog-v1.schema.json",
  "title": "Mo.Blend Template Library Catalog (index.json)",
  "description": "Canonical schema for the flattened template library catalog served at {registryBaseUrl}/index.json. Generated by MoBlend_Lib CI (or scripts/build_index.py). Consumed by the broker GET /api/v1/templates and all gallery clients. Authoritative copy also lives in MoBlend_Lib/schemas/catalog-v1.schema.json.",
  "type": "object",
  "required": ["version", "generated_at", "templates"],
  "additionalProperties": false,
  "properties": {
    "version": {
      "type": "string",
      "const": "1.0",
      "description": "Catalog envelope schema version."
    },
    "generated_at": {
      "type": "string",
      "format": "date-time",
      "description": "ISO 8601 UTC timestamp when index.json was last built."
    },
    "base_url": {
      "type": "string",
      "format": "uri",
      "description": "Absolute URL prefix for resolving relative artifact paths in entries. Typically the raw Git CDN root or lib.moblend.dev origin."
    },
    "templates": {
      "type": "array",
      "items": { "$ref": "#/$defs/catalogEntry" }
    }
  },
  "$defs": {
    "catalogEntry": {
      "type": "object",
      "required": [
        "template_id",
        "name",
        "category",
        "description",
        "version",
        "preview_url",
        "download_url"
      ],
      "additionalProperties": false,
      "properties": {
        "template_id": {
          "type": "string",
          "pattern": "^[a-z0-9]+(?:-[a-z0-9]+)*$",
          "description": "Stable kebab-case id; matches manifest template_id."
        },
        "name": {
          "type": "string",
          "description": "Human-readable display name."
        },
        "category": {
          "type": "string",
          "description": "Registry category slug, e.g. lower-thirds, alerts, transitions, demo."
        },
        "description": {
          "type": "string"
        },
        "version": {
          "type": "string",
          "description": "Template content version (SemVer). Clients compare against installed_templates.catalog_version to skip re-download."
        },
        "preview_url": {
          "type": "string",
          "format": "uri",
          "description": "Absolute URL to .webp preview (animated preferred; static acceptable for bootstrap)."
        },
        "download_url": {
          "type": "string",
          "format": "uri",
          "description": "Absolute URL to the .mo.blend binary. Go InstallTemplate streams this URL."
        },
        "manifest_url": {
          "type": "string",
          "format": "uri",
          "description": "Optional absolute URL to extracted .manifest.json for offline inspection."
        },
        "tags": {
          "type": "array",
          "items": { "type": "string" },
          "description": "Optional discovery tags (M4d+ search/filter)."
        },
        "parameters": {
          "type": "array",
          "description": "Parameter summary for gallery and MCP list_templates (id, type, label only — not full manifest).",
          "items": {
            "type": "object",
            "required": ["id", "type"],
            "additionalProperties": false,
            "properties": {
              "id": { "type": "string" },
              "type": { "type": "string" },
              "label": { "type": "string" }
            }
          }
        }
      }
    }
  }
}